{
  "contract_version": 1,
  "suite": "next_episode",
  "case_id": "accepts_date_only_release_at_utc_boundary",
  "now_ms": 1738368000000,
  "input": {
    "current_season": 1,
    "current_episode": 0,
    "show_id": null,
    "watched_set": null,
    "episodes": [
      {
        "season": 1,
        "episode": 1,
        "title": "Premiere",
        "released": "2025-02-01"
      },
      {
        "season": 1,
        "episode": 2,
        "title": "Later",
        "released": "2025-02-02"
      }
    ]
  },
  "expected": {
    "result": {
      "season": 1,
      "episode": 1,
      "title": "Premiere"
    }
  }
}
